{
  "schemaVersion": "0.1.0",
  "id": "sunny-meadow",
  "title": "Sunny Meadow",
  "description": "A gentle meadow crossed by a winding stream.",
  "seed": "mapsoo-demo-001",
  "visual": {
    "style": "pixel-art",
    "tileSize": 32,
    "palette": [
      "#2f5d3a",
      "#76a950",
      "#b8d978",
      "#4f91ad",
      "#d6c18b"
    ]
  },
  "map": {
    "width": 24,
    "height": 16,
    "biome": "meadow"
  },
  "output": {
    "targets": [
      "common",
      "godot",
      "itch"
    ],
    "assetLicense": "CC0-1.0"
  }
}
